Label,CURIE,CURIE (Full),Description,Domain,Range,Min,Max,M/MA/O,Recroding methid,Transcription method,VES,SES,Bib mapping,Authority mapping,Instruction number,Element type,Status,Notes on application,
has equipment or system requirement,P30162,rdam:P30162,Relates a manifestation to a system or equipment required for access to the content of an electronic analog or digital manifestation.,Manifestation,N/A,0,>1,MA,Unstructured,Normalised,,MARC 21,538 $a,,3.2,6,Published,,
has numbering of sequence,P30165,rdam:P30165,Relates a manifestation to the first and last designations of a sequence of manifestations of the individual parts or iterations of a manifestation.,Manifestation,N/A,0,>1,O,Unstructured,,,MARC 21,500 $a,,2.6,6,Published,,
has ISSN of series (Deprecated),P30166,rdam:P30166,Relates a manifestation to an identifier for manifestation that is assigned to a series by an ISSN registration agency. (Deprecated),,,,,,,,,,,,,,Deprecated,,
has ISSN of subseries (Deprecated),P30167,rdam:P30167,Relates a manifestation to an identifier for manifestation that is assigned to a subseries by an ISSN registration agency. (Deprecated),,,,,,,,,,,,,,Deprecated,,
has frequency (Deprecated),P30168,rdam:P30168,Relates a manifestation to an interval at which an issue or part of a serial or an update to an integrating resource is issued. (Deprecated),,,,,,,,,,,,,,Deprecated,,
has type of recording,P30172,rdam:P30172,Relates a manifestation to a method used to encode audio content for playback.,Manifestation,N/A,0,>1,O,Structured,N/A,RDA Type of Recording,MARC 21,300 $b,,3.16.2,4,Published,May also be unstructured 500 $a,
has type of recording,P30172,rdam:P30172,Relates a manifestation to a method used to encode audio content for playback.,Manifestation,N/A,0,>1,O,Structured,N/A,RDA Type of Recording,MARC 21,344 $a,,3.16.2,4,Published,May also be unstructured 500 $a,
has name of publisher,P30176,rdam:P30176,Relates a manifestation to a nomen that is a name of an agent who is responsible for publishing a manifestation.,Manifestation,Nomen,0,1,MA,Unstructured,Normalised,,MARC 21,264 $b [260 $b],,2.8.4,3,Published,,
has extent of cartographic resource (Deprecated),P30177,rdam:P30177,Relates a manifestation to the number and type of units and/or subunits making up a cartographic resource. (Deprecated),,,,,,,,,,,,,,Deprecated,,
has extent of notated music (Deprecated),P30178,rdam:P30178,"Relates a manifestation to the number and type of units and/or subunits making up a resource consisting of notated music, with or without accompanying text and/or illustrations. (Deprecated)",,,,,,,,,,,,,,Deprecated,,
has extent of still image (Deprecated),P30179,rdam:P30179,Relates a manifestation to the number and type of units and/or subunits making up a resource consisting of one or more still images. (Deprecated),,,,,,,,,,,,,,Deprecated,,
has extent of three-dimensional form (Deprecated),P30180,rdam:P30180,Relates a manifestation to the number and type of units and/or subunits making up a resource consisting of one or more three-dimensional forms. (Deprecated),,,,,,,,,,,,,,Deprecated,,
has extent of text (Deprecated),P30181,rdam:P30181,"Relates a manifestation to the number and type of units and/or subunits making up a resource consisting of text, with or without accompanying illustrations. (Deprecated)",,,,,,,,,,,,,,Deprecated,,
has extent of manifestation,P30182,rdam:P30182,,Manifestation,N/A,1,1,M,Structured,Normalised,,MARC 21,300 $a,,3.4,6,Published,,
has extent of manifestation,P30182,rdam:P30182,Relates a manifestation to a number and type of unit or subunit of a manifestation.,,,,,,,,,,,,,,Published,,
has file size,P30183,rdam:P30183,Relates a manifestation to a number of bytes in a digital file.,,,,,,,,,,,,,,Published,,
has configuration of playback channels,P30184,rdam:P30184,Relates a manifestation to a number of sound channels used to make a recording.,Manifestation,N/A,1,1,O,Structured,N/A,RDA Configuration of Playback Channels,MARC 21,300 $b,,3.16.8,4,Published,With local instructions,
has tape configuration,P30185,rdam:P30185,Relates a manifestation to a number of tracks on an audiotape.,,,,,,,,,,,,,,Published,,
has production method for tactile resource (Deprecated),P30188,rdam:P30188,Relates a manifestation to the process used to produce a tactile resource.,,,,,,,,,,,,,,Deprecated,,
has production method for manuscript (Deprecated),P30189,rdam:P30189,Relates a manifestation to the process used to produce an original manuscript or a copy.,,,,,,,,,,,,,,Deprecated,,
has generation of audio recording (Deprecated),P30190,rdam:P30190,Relates a manifestation to the relationship between an original audio carrier and the carrier of a reproduction made from the original.,,,,,,,,,,,,,,Deprecated,,
has generation of digital resource (Deprecated),P30192,rdam:P30192,Relates a manifestation to the relationship between an original carrier of a digital resource and the carrier of a reproduction made from the original.,,,,,,,,,,,,,,Deprecated,,
has generation of motion picture film (Deprecated),P30193,rdam:P30193,Relates a manifestation to the relationship between an original carrier of a motion picture film resource and the carrier of a reproduction made from the original.,,,,,,,,,,,,,,Deprecated,,
has generation of videotape (Deprecated),P30194,rdam:P30194,Relates a manifestation to the relationship between an original carrier of a videotape resource and the carrier of a reproduction made from the original.,,,,,,,,,,,,,,Deprecated,,
has generation of microform (Deprecated),P30195,rdam:P30195,Relates a manifestation to the relationship between an original microform carrier and the carrier of a reproduction made from the original.,,,,,,,,,,,,,,Deprecated,,
has bibliographic format,P30197,rdam:P30197,"Relates a manifestation to a proportional relationship between a whole sheet and the individual leaves that result if that sheet is left full, cut, or folded in a manifestation.",Manifestation,N/A,0,>1,O,Unstructured,Normalised,,MARC 21,500 $a,,3.12,4,Published,,
has font size,P30199,rdam:P30199,Relates a manifestation to a size of the type that is used to represent the characters and symbols in a manifestation.,Manifestation,N/A,0,1,O,Unstructured,Normalised,,MARC 21,500 $a,,3.13,4,Published,,
has playing speed,P30201,rdam:P30201,Relates a manifestation to a speed at which an audio carrier must be operated to produce the sound intended.,Manifestation,N/A,0,1,O,Structured,,,MARC 21,300 $b,,3.16.4,5,Published,Instruction number supplied; May also be unstructured 500 $a,
has parallel title proper,P30203,rdam:P30203,Relates a manifestation to a nomen that is a title proper in another language or script.,Manifestation,Nomen,0,>1,MA,Unstructured,Normalised,,MARC 21,245 $b,,2.3.3,3,Published,,
has parallel title of series,P30204,rdam:P30204,Relates a manifestation to a nomen that is a title of a series in another language or script.,Manifestation,Nomen,1,>1,O,Unstructured,Normalised,,MARC 21,490 $a,,2.12.3,3,Published,,
has parallel title proper of subseries (Deprecated),P30205,rdam:P30205,Relates a manifestation to a title proper of a subseries in another language or script. (Deprecated),,,,,,,,,,,,,,Deprecated,,
"has base material for microfilm, microfiche, photographic film, and motion picture film (Deprecated)",P30207,rdam:P30207,"Relates a manifestation to the underlying physical material of a microfilm, microfiche, photographic film, or motion picture film resource. (Deprecated)",,,,,,,,,,,,,,Deprecated,,
has key title (Deprecated),P30209,rdam:P30209,Relates a manifestation to a title that is unique assigned to a manifestation by an ISSN registration agency. (Deprecated),,,,,,,,,,,,,,Deprecated,,
has accompanying manifestation relationship with (Deprecated),P30210,rdam:P30210,Relates a manifestation to a manifestation that accompanies or is accompanied by another manifestation. (Deprecated),,,,,,,,,,,,,,Deprecated,,
has descriptive manifestation relationship with (Deprecated),P30211,rdam:P30211,Relates a manifestation to a work that is a description of the manifestation. (Deprecated),,,,,,,,,,,,,,Deprecated,,
has equivalent manifestation relationship with (Deprecated),P30212,rdam:P30212,Relates a manifestation to a manifestation that is equivalent to another manifestation. (Deprecated),,,,,,,,,,,,,,Deprecated,,
has whole-part manifestation relationship with (Deprecated),P30213,rdam:P30213,Relates a manifestation to a manifestation that is contained in or contains another manifestation. (Deprecated),,,,,,,,,,,,,,Deprecated,,
has note on carrier,P30214,rdam:P30214,Relates a manifestation to a note on manifestation that provides information on attributes of a carrier of a manifestation.,Manifestation,N/A,0,>1,O,Unstructured,Normalised,,MARC 21,500 $a,,3.21,6,Published,344 $a (structured) may be used in future,
has details of bibliographic format,P30218,rdam:P30218,"Relates a manifestation to details of a proportional relationship between a whole sheet in a printed or manuscript resource and the individual leaves that result if that sheet is left full, cut, or folded.",Manifestation,N/A,0,>1,O,Unstructured,Normalised,,MARC 21,500 $a,,3.12.1.4,6,Published,,
has details of broadcast standard,P30219,rdam:P30219,Relates a manifestation to details of a system that is used to format a manifestation of a video for television broadcast.,Manifestation,N/A,0,>1,O,Unstructured,Normalised,,MARC 21,500 $a,,3.18.3.4,6,Published,,
has details of digital representation of cartographic content,P30222,rdam:P30222,Relates a manifestation to details of an encoding of geospatial information in a manifestation.,Manifestation,N/A,0,>1,O,Unstructured,Normalised,,MARC 21,500 $a,,3.19.8.4,6,Published,,
has details of font size,P30226,rdam:P30226,Relates a manifestation to details of a size of the type that is used to represent the characters and symbols in a manifestation.,Manifestation,N/A,0,1,O,Unstructured,Normalised,,MARC 21,500 $a,,3.13.1.4,6,Published,,
has details of generation of audio recording (Deprecated),P30227,rdam:P30227,Relates a manifestation to details of the relationship between an original audio carrier and the carrier of a reproduction made from the original.,,,,,,,,,,,,,,Deprecated,,
has details of generation of digital resource (Deprecated),P30228,rdam:P30228,Relates a manifestation to details of the relationship between an original carrier of a digital resource and the carrier of a reproduction made from the original.,,,,,,,,,,,,,,Deprecated,,
has details of generation of microform (Deprecated),P30229,rdam:P30229,Relates a manifestation to details of the relationship between an original microform carrier and the carrier of a reproduction made from the original.,,,,,,,,,,,,,,Deprecated,,
has details of generation of motion picture film (Deprecated),P30230,rdam:P30230,Relates a manifestation to details of the relationship between an original carrier of a motion picture film resource and the carrier of a reproduction made from the original.,,,,,,,,,,,,,,Deprecated,,
has details of generation of videotape (Deprecated),P30231,rdam:P30231,Relates a manifestation to details of the relationship between an original carrier of a videotape resource and the carrier of a reproduction made from the original.,,,,,,,,,,,,,,Deprecated,,
has details of layout,P30233,rdam:P30233,"Relates a manifestation to details of an arrangement of text, images, tactile notation, or other content in a manifestation.",Manifestation,N/A,0,1,O,Unstructured,Normalised,,MARC 21,500 $a,,3.11.1.4,6,Published,,
has details of production method for manuscript (Deprecated),P30239,rdam:P30239,Relates a manifestation to details of a process used to produce an original manuscript or a copy. (Deprecated),,,,,,,,,,,,,,Deprecated,,
has details of production method for tactile resource (Deprecated),P30240,rdam:P30240,Relates a manifestation to details of a process used to produce a tactile resource. (Deprecated),,,,,,,,,,,,,,Deprecated,,
has details of recording medium,P30243,rdam:P30243,Relates a manifestation to details of a type of medium that is used to record sound on an audio carrier.,Manifestation,N/A,0,1,O,Unstructured,Normalised,,MARC 21,500 $a,,3.16.3.4,6,Published,,
has details of tape configuration,P30247,rdam:P30247,Relates a manifestation to details of a number of tracks on an audiotape.,Manifestation,N/A,0,1,O,Unstructured,Normalised,,MARC 21,500 $a,,3.16.7.4,6,Published,,
has details of video format,P30251,rdam:P30251,Relates a manifestation to details of a schema or standard that is used to encode the analog video content of a manifestation.,Manifestation,N/A,0,>1,O,Unstructured,Normalised,,MARC 21,500 $a,,3.18.2.4,6,Published,,
is subject manifestation of,P30253,rdam:P30253,Relates a manifestation to a work that is about a manifestation.,Manifestation,Work,0,>1,O,Unstructured,Normalised,,MARC 21,500 $a,,,2,Published,May also be unstructured 500 $a,
has note on identifier for manifestation,P30260,rdam:P30260,Relates a manifestation to a note on manifestation that provides information on an identifier for a manifestation.,Manifestation,N/A,0,>1,MA,Unstructured,Normalised,,MARC 21,500 $a,,2.17.14,6,Published,,
has details of cartographic data type,P30262,rdam:P30262,Relates a manifestation to details of a machine-readable representation of geospatial features.,Manifestation,N/A,0,>1,O,Unstructured,Normalised,,MARC 21,500 $a,,3.19.8.5.4,6,Published,,
has related work of manifestation,P30265,rdam:P30265,Relates a manifestation to a work that is associated with a manifestation.,,,,,,,,,,,,,,Published,,
has related person of manifestation,P30268,rdam:P30268,Relates a manifestation to a person who is associated with a manifestation.,Manifestation,Person,0,>1,O,Structured,N/A,SCIS Authorities,MARC 21,"700 0,1 $a,b,c",,21.6.1.3,1,Published,May also be unstructured 500 $a,
has related family of manifestation,P30269,rdam:P30269,Relates a manifestation to a family who is associated with a manifestation.,Manifestation,Family,0,>1,O,Structured,N/A,SCIS Authorities,MARC 21,"700 3 $a,b,c",,21.1.2,1,Published,,
has related corporate body of manifestation,P30270,rdam:P30270,Relates a manifestation to a corporate body who is associated with a manifestation.,Manifestation,Corporate body,0,>1,O,Structured,N/A,SCIS Authorities,MARC 21,"710 $a,b,c / 711 $a,c,d,e,n",,21.1.2,1,Published,Instruction number supplied,
has related place of manifestation,P30272,rdam:P30272,Relates a manifestation to a place that is associated with a manifestation.,Manifestation,Place,0,>1,MA,Unstructured,Normalised,,MARC 21,264 $a,,2.8.2,1,Published,May also be unstructured 500 $a,
has related timespan of manifestation,P30273,rdam:P30273,Relates a manifestation to a timespan that is associated with a manifestation.,Manifestation,Timespan,1,1,M,Unstructured,Normalised,,MARC 21,264 $c,,2.8.6,1,Published,May also be unstructured 500 $a,
has details of regional encoding,P30275,rdam:P30275,"Relates a manifestation to details of a designation for one or more regions of the world for which a videodisc or video game carrier has been encoded, indicating that playback is restricted to a device configured to decode it.",Manifestation,N/A,0,>1,O,Unstructured,Normalised,,MARC 21,500 $a,,3.19.6.4,6,Published,,
has details of regional encoding,P30275,rdam:P30275,"Relates a manifestation to details of a designation for one or more regions of the world for which a videodisc or video game carrier has been encoded, indicating that playback is restricted to a device configured to decode it.",Manifestation,N/A,0,>1,O,Unstructured,Normalised,,MARC 21,538 $a,,3.19.6.4,6,Published,346 $b (structured) may be used in future,
has name of agent of manifestation,P30297,rdam:P30297,"Relates a manifestation to a nomen that is a name of an agent who is responsible for distributing, printing, duplicating, casting, publishing, releasing, or issuing a published manifestation, or inscribing, fabricating, constructing, or other method of producing an unpublished manifestation.",Manifestation,Nomen,0,1,MA,Unstructured,Normalised,,MARC 21,264 $b,,2.8.4,3,Published,,
has category of manifestation,P30335,rdam:P30335,Relates a manifestation to a type to which a manifestation belongs.,Manifestation,N/A,1,1,M,Structured,,MARC,MARC 21,Leader pos 06?,,,5,Published,,
has contributor person to aggregate,P30336,rdam:P30336,Relates a manifestation to a person who is responsible for creating an expression of a work that is embodied by an aggregate.,Manifestation,Person,0,>1,O,Structured,N/A,SCIS Authorities,MARC 21,"700 0,1 $a,b,c",,,2,Published,,
has contributor person of cartography,P30338,rdam:P30338,Relates a manifestation to a person who is a contributor to aggregate who creates an expression of a cartographic work that is embodied by an aggregate.,Manifestation,Person,0,>1,O,Structured,N/A,SCIS Authorities,MARC 21,"700 0,1 $a,b,c",,,2,Published,,
has contributor person of moving image,P30340,rdam:P30340,Relates a manifestation to a person who is a contributor to aggregate who creates an expression of a moving image work that is embodied by an aggregate.,Manifestation,Person,0,>1,O,Structured,N/A,SCIS Authorities,MARC 21,"700 0,1 $a,b,c",,,2,Published,,
has contributor person of music,P30341,rdam:P30341,Relates a manifestation to a person who is a contributor to aggregate who creates an expression of a musical work that is embodied by an aggregate.,Manifestation,Person,0,>1,O,Structured,N/A,SCIS Authorities,MARC 21,"700 0,1 $a,b,c",,,2,Published,,
has contributor person of speech,P30342,rdam:P30342,Relates a manifestation to a person who is a contributor to aggregate who creates an expression of a vocal work that is embodied by an aggregate.,Manifestation,Person,0,>1,O,Structured,N/A,SCIS Authorities,MARC 21,"700 0,1 $a,b,c",,,2,Published,,
has contributor person of still image,P30343,rdam:P30343,Relates a manifestation to a person who is a contributor to aggregate who creates an expression of a still image work that is embodied by an aggregate.,Manifestation,Person,0,>1,O,Structured,N/A,SCIS Authorities,MARC 21,"700 0,1 $a,b,c",,,2,Published,,
has contributor person of text,P30344,rdam:P30344,Relates a manifestation to a person who is a contributor to aggregate who creates an expression of a textual work that is embodied by an aggregate.,Manifestation,Person,0,>1,O,Structured,N/A,SCIS Authorities,MARC 21,"700 0,1 $a,b,c",,,2,Published,,
has contributor person of computer content,P30346,rdam:P30346,Relates a manifestation to a person who is a contributor to aggregate who creates an expression of computer content that is embodied by an aggregate.,Manifestation,Person,0,>1,O,Structured,N/A,SCIS Authorities,MARC 21,"700 0,1 $a,b,c",,,2,Published,,
has broadcaster person,P30347,rdam:P30347,"Relates a manifestation to a person who is responsible for broadcasting a manifestation to an audience via radio, television, webcast, or other transmission media.",Manifestation,Person,0,>1,O,Structured,N/A,SCIS Authorities,MARC 21,"700 0,1 $a,b,c",,,2,Published,347 structured description may be used in future,
has film distributor person,P30348,rdam:P30348,Relates a manifestation to a person who is responsible for distributing a moving image manifestation to theatres or other distribution channels.,Manifestation,Person,0,>1,O,Unstructured,Normalised,,MARC 21,500 $a,,,2,Published,,
has producer person of unpublished manifestation,P30360,rdam:P30360,"Relates a manifestation to a person who is responsible for inscribing, fabricating, constructing, or other method of producing an unpublished manifestation.",Manifestation,Person,0,>1,O,Structured,N/A,SCIS Authorities,MARC 21,"700 0,1 $a,b,c",,,2,Published,Instruction number supplied,
has publisher person,P30362,rdam:P30362,"Relates a manifestation to a person who is responsible for publishing, releasing, or issuing a published manifestation.",Manifestation,Person,0,1,MA,Unstructured,Normalised,,MARC 21,264 $b,,,2,Published,Instruction number supplied,
has creator person of manifestation,P30363,rdam:P30363,Relates a manifestation to a person who is responsible for the embodiment of one or more expressions.,Manifestation,Person,0,>1,O,Structured,N/A,SCIS Authorities,MARC 21,"700 0,1 $a,b,c",,,2,Published,,
has contributor corporate body to aggregate,P30394,rdam:P30394,Relates a manifestation to a corporate body who is responsible for creating an expression of a work that is embodied by an aggregate.,Manifestation,Corporate body,0,>1,O,Structured,N/A,SCIS Authorities,MARC 21,"710 $a,b,c",,,2,Published,,
has contributor corporate body to aggregate,P30394,rdam:P30394,Relates a manifestation to a corporate body who is responsible for creating an expression of a work that is embodied by an aggregate.,,,,,,,,,,,,,,Published,,
has contributor corporate body of cartography,P30396,rdam:P30396,Relates a manifestation to a corporate body who is a contributor to aggregate who creates an expression of a cartographic work that is embodied by an aggregate.,Manifestation,Corporate body,0,>1,O,Structured,N/A,SCIS Authorities,MARC 21,"710 $a,b,c",,,2,Published,347?,
has contributor corporate body of moving image,P30398,rdam:P30398,Relates a manifestation to a corporate body who is a contributor to aggregate who creates an expression of a moving image work that is embodied by an aggregate.,Manifestation,Corporate body,0,>1,O,Structured,N/A,SCIS Authorities,MARC 21,"710 $a,b,c",,,2,Published,,
has contributor corporate body of music,P30399,rdam:P30399,Relates a manifestation to a corporate body who is a contributor to aggregate who creates an expression of a musical work that is embodied by an aggregate.,Manifestation,Corporate body,0,>1,O,Structured,N/A,SCIS Authorities,MARC 21,"710 $a,b,c",,,2,Published,,
has contributor corporate body of speech,P30400,rdam:P30400,Relates a manifestation to a corporate body who is a contributor to aggregate who creates an expression of a vocal work that is embodied by an aggregate.,Manifestation,Corporate body,0,>1,O,Structured,N/A,SCIS Authorities,MARC 21,"710 $a,b,c",,,2,Published,,
has contributor corporate body of still image,P30401,rdam:P30401,Relates a manifestation to a corporate body who is a contributor to aggregate who creates an expression of a still image work that is embodied by an aggregate.,Manifestation,Corporate body,0,>1,O,Structured,N/A,SCIS Authorities,MARC 21,"710 $a,b,c",,,2,Published,,
has contributor corporate body of text,P30402,rdam:P30402,Relates a manifestation to a corporate body who is a contributor to aggregate who creates an expression of a textual work that is embodied by an aggregate.,Manifestation,Corporate body,0,>1,O,Structured,N/A,SCIS Authorities,MARC 21,"710 $a,b,c",,,2,Published,,
has contributor corporate body of computer content,P30404,rdam:P30404,Relates a manifestation to a corporate body who is a contributor to aggregate who creates an expression of computer content that is embodied by an aggregate.,Manifestation,Corporate body,0,>1,O,Structured,N/A,SCIS Authorities,MARC 21,"710 $a,b,c",,,2,Published,,
has broadcaster corporate body,P30405,rdam:P30405,"Relates a manifestation to a corporate body who is responsible for broadcasting a manifestation to an audience via radio, television, webcast, or other transmission media.",Manifestation,Corporate body,0,>1,O,Structured,N/A,SCIS Authorities,MARC 21,"710 $a,b,c",,,2,Published,,
has producer corporate body of unpublished manifestation,P30418,rdam:P30418,"Relates a manifestation to a corporate body who is responsible for inscribing, fabricating, constructing, or other method of producing an unpublished manifestation.",Manifestation,Corporate body,0,>1,O,Structured,N/A,SCIS Authorities,MARC 21,"710 $a,b,c",,,2,Published,Instruction number supplied; May also be unstructured 500 $a,
has publisher corporate body,P30420,rdam:P30420,"Relates a manifestation to a corporate body who is responsible for publishing, releasing, or issuing a published manifestation.",Manifestation,Corporate body,0,1,MA,Unstructured,Normalised,,MARC 21,264 $b,,,2,Published,Instruction number supplied,
has creator corporate body of manifestation,P30421,rdam:P30421,Relates a manifestation to a corporate body who is responsible for the embodiment of one or more expressions.,Manifestation,Corporate body,0,>1,O,Structured,N/A,SCIS Authorities,MARC 21,"710 $a,b,c",,,2,Published,,
has contributor family to aggregate,P30423,rdam:P30423,Relates a manifestation to a family who is responsible for creating an expression of a work that is embodied by an aggregate.,Manifestation,Family,0,>1,O,Structured,N/A,SCIS Authorities,MARC 21,700 3 $a,,,2,Published,,
has contributor family of cartography,P30425,rdam:P30425,Relates a manifestation to a family who is a contributor to aggregate who creates an expression of a cartographic work that is embodied by an aggregate.,Manifestation,Family,0,>1,O,Structured,N/A,SCIS Authorities,MARC 21,700 3 $a,,,2,Published,,
has contributor family of moving image,P30427,rdam:P30427,Relates a manifestation to a family who is a contributor to aggregate who creates an expression of a moving image work that is embodied by an aggregate.,Manifestation,Family,0,>1,O,Structured,N/A,SCIS Authorities,MARC 21,700 3 $a,,,2,Published,,
has contributor family of music,P30428,rdam:P30428,Relates a manifestation to a family who is a contributor to aggregate who creates an expression of a musical work that is embodied by an aggregate.,Manifestation,Family,0,>1,O,Structured,N/A,SCIS Authorities,MARC 21,700 3 $a,,,2,Published,,
has contributor family of speech,P30429,rdam:P30429,Relates a manifestation to a family who is a contributor to aggregate who creates an expression of a vocal work that is embodied by an aggregate.,Manifestation,Family,0,>1,O,Structured,N/A,SCIS Authorities,MARC 21,700 3 $a,,,2,Published,,
