Label,CURIE,CURIE (Full),Description,Domain,Range,Min,Max,M/MA/O,Recroding methid,Transcription method,VES,SES,Bib mapping,Authority mapping,Instruction number,Element type,Status,Notes on application,
has cartographic data type,,rdam:P30261,Relates a manifestation to a machine-readable representation of geospatial features.,Manifestation,N/A,0,>1,O,Unstructured,Normalised,,MARC 21,500 $a,,3.19.8.5,,Published,Not in spreadsheet before importing the unused elements. LC has it as core for digital cartographic resources; however it is an option to record 'details of cartographic type' (P30262) instead - maybe this is why it was omitted?,
has distributor person,P30359,rdam:P30359,Relates a manifestation to a person who is responsible for distributing a published manifestation.,Manifestation,Person,0,>1,O,Unstructured,Normalised,,MARC 21,500 $a,,,2,Published,"Is this only ever used for films? In which case there is a narrower element, film distributor person, P30348. But see the application note at P30406",
has film distributor corporate body,P30406,rdam:P30406,Relates a manifestation to a corporate body who is responsible for distributing a moving image manifestation to theatres or other distribution channels.,Manifestation,Corporate body,0,>1,O,Unstructured,Normalised,,MARC 21,500 $a,,,2,Published,Do we ever use these? Rarely. Change Standards to leave out.,
has distributor corporate body,P30417,rdam:P30417,Relates a manifestation to a corporate body who is responsible for distributing a published manifestation.,Manifestation,Corporate body,0,>1,O,Unstructured,Normalised,,MARC 21,500 $a,,,2,Published,This is a broader element of film distributor corporate body. See also the note at P30406.,
has film distributor family,P30435,rdam:P30435,Relates a manifestation to a family who is responsible for distributing a moving image manifestation to theatres or other distribution channels.,Manifestation,Family,0,>1,O,Unstructured,Normalised,,MARC 21,500 $a,,,2,Published,,
has distributor family,P30446,rdam:P30446,Relates a manifestation to a family who is responsible for distributing a published manifestation.,Manifestation,Family,0,>1,O,Unstructured,Normalised,,MARC 21,500 $a,,,2,Published,Broader element of film distributor family,
has carrier type,P30001,rdam:P30001,"Relates a manifestation to a categorization reflecting the format of the storage medium and housing of a carrier in combination with the type of intermediation device required to view, play, run, or otherwise access the content of a manifestation.",Manifestation,N/A,1,>1,M,Structured,N/A,RDA Carrier Type,MARC 21,338 $a,,3.3,4,Published,,O = Optional
has media type,P30002,rdam:P30002,"Relates a manifestation to a categorization that reflects the general type of intermediation device required to view, play, run, or otherwise access the content of a manifestation.",Manifestation,N/A,1,>1,M,Structured,N/A,RDA Media Type,MARC 21,337 $a,,3.2,4,Published,,
has mode of issuance,P30003,rdam:P30003,Relates a manifestation to a categorization that reflects whether a manifestation is issued in one or more units.,Manifestation,N/A,1,1,M,Structured,N/A,MARC 21,MARC 21,000 leader /07,,2.13,4,Published,,
has identifier for manifestation,P30004,rdam:P30004,"Relates a manifestation to a nomen that is a n appellation of manifestation that consists of a code, number, or other string, usually independent of natural language and social naming conventions, used to identify a manifestation.",Manifestation,Nomen,0,>1,MA,Identifier,Normalised,ISBN / ISSN ,MARC 21,020 $a /024 $a / 028 $a,,2.15,3,Published,,
has regional encoding,P30006,rdam:P30006,"Relates a manifestation to a designation for one or more regions of the world for which a videodisc or video game carrier has been encoded, indicating that playback is restricted to a device configured to decode it.",Manifestation,N/A,0,1,O,Unstructured,Normalised,,MARC 21,538 $a,,,,Published,,
has regional encoding,P30006,rdam:P30006,"Relates a manifestation to a designation for one or more regions of the world for which a videodisc or video game carrier has been encoded, indicating that playback is restricted to a device configured to decode it.",Manifestation,N/A,0,1,O,Structured,N/A,,MARC 21,347 $e,,3.19.6,4,Published,Instruction number supplied,
has date of production,P30009,rdam:P30009,"Relates a manifestation to a timespan during which an unpublished manifestation is inscribed, fabricated, constructed, or otherwise produced.",Manifestation,Timespan,0,1,O ,Identifier,N/A,MARC 21,MARC 21,008 /07-14,,,,Published,,
has date of production,P30009,rdam:P30009,"Relates a manifestation to a timespan during which an unpublished manifestation is inscribed, fabricated, constructed, or otherwise produced.",Manifestation,Timespan,0,1,O ,Unstructured,Normalised,,MARC 21,264 $c,,2.7.6,3,Published,,
has date of publication,P30011,rdam:P30011,"Relates a manifestation to a timespan during which a published manifestation is published, released, or issued.",Manifestation,Timespan,1,1,M,Identifier,N/A,MARC 21,MARC 21,008 /07-14,,,,Published,,
has date of publication,P30011,rdam:P30011,"Relates a manifestation to a timespan during which a published manifestation is published, released, or issued.",Manifestation,Timespan,1,1,M,Unstructured,Normalised,,MARC 21,264 $c,,2.8.6,3,Published,,
has numbering within sequence,P30014,rdam:P30014,Relates a manifestation to a nomen that is a designation that is assigned to a manifestation to identify its position in a sequence of individual parts of a larger manifestation or parts or issues of a larger work.,Manifestation,N/A,0,>1,MA,Unstructured,Normalised,,MARC 21,490 $v,,2.12.9,6,Published,,
has numbering within sequence,P30014,rdam:P30014,Relates a manifestation to a nomen that is a designation that is assigned to a manifestation to identify its position in a sequence of individual parts of a larger manifestation or parts or issues of a larger work.,Manifestation,N/A,0,>1,MA,Unstructured,Normalised,,MARC 21,830 $v,,2.12.9,6,Published,,
has numbering within subseries (Deprecated),P30015,rdam:P30015,Relates a manifestation to a designation of the sequencing of a part or parts within a subseries. (Deprecated),,,,,,,,,,,,,,Deprecated,,
has file type,P30018,rdam:P30018,Relates a manifestation to a general type of data content encoded in a computer file.,Manifestation,N/A,0,1,O ,Unstructured,Normalised,,MARC 21,500 $a,,3.19.2,4,Published,,
is facsimile part of,P30019,rdam:P30019,Relates a manifestation to a manifestation that is a part manifestation that exactly reproduces another manifestation.,Manifestation,Manifestation,0,>1,O,Unstructured,Normalised,,MARC 21,500 $a,,24.5,2,Published,,
is part of manifestation,P30020,rdam:P30020,Relates a manifestation to a manifestation that has another manifestation as a discrete component.,Manifestation,Manifestation,0,1,O ,Unstructured,Normalised,,MARC 21,500 $a,,24.5,2,Published,May also be unstructured 500 $a,
has insert,P30022,rdam:P30022,Relates a manifestation to a manifestation that is a separate part of another manifestation.,Manifestation,Manifestation,0,1,O,Unstructured,Normalised,,MARC 21,500 $a,,24.5,2,Published,,
is description of (manifestation) (Deprecated),P30023,rdam:P30023,Relates a work to a manifestation described by a describing work. (Deprecated),,,,,,,,,,,,,,Deprecated,,
is inserted in,P30025,rdam:P30025,Relates a manifestation to a manifestation that includes another manifestation as a separate part.,Manifestation,Manifestation,0,,O,Unstructured,Normalised,,MARC 21,500 $a,,24.5,2,Published,May also be unstructured 500 $a,
is also issued as,P30026,rdam:P30026,Relates a manifestation to a manifestation that embodies the same expression of a work in a different format.,Manifestation,Manifestation,0,>1,O,Unstructured,Normalised,,MARC 21,500 $a,,24.5,2,Published,,
is accompanied by manifestation,P30027,rdam:P30027,Relates a manifestation to a manifestation that is a part of the same manifestation as another part manifestation.,Manifestation,Manifestation,0,>1,MA,Unstructured,Normalised,,MARC 21,500 $a,,24.5,2,Published,,
has mirror site,P30028,rdam:P30028,Relates a manifestation to a manifestation that is an exact copy of a website that is used to reduce network traffic or improve the availability of the content of the original site.,Manifestation,Manifestation,0,>1,O ,Unstructured,Normalised,,MARC 21,500 $a,,24.5,2,Published,,
has special issue (Deprecated),P30030,rdam:P30030,"Relates a manifestation to a manifestation that consists of a single issue or a supplementary section of a periodical or newspaper devoted to a special subject, with or without serial numbering. (Deprecated)",,,,,,,,,,,,,,Deprecated,,
is analysis of (manifestation) (Deprecated),P30032,rdam:P30032,Relates a work to a manifestation that has been examined to identify its components and their relations. (Deprecated),,,,,,,,,,,,,,Deprecated,,
has part manifestation,P30033,rdam:P30033,Relates a manifestation to a manifestation that is a discrete component of another manifestation.,Manifestation,Manifestation,0,>1,O ,Unstructured,Normalised,,MARC 21,500 $a,,24.5,2,Published,,
is evaluation of (manifestation) (Deprecated),P30034,rdam:P30034,Relates a work to a manifestation that is examined or judged. (Deprecated),,,,,,,,,,,,,,Deprecated,,
is on disc with manifestation,P30036,rdam:P30036,Relates a manifestation to a manifestation that is issued on the same disc with a manifestation being described.,Manifestation,Manifestation,0,,O ,Unstructured,Normalised,,MARC 21,500 $a,,24.5,2,Published,May also be unstructured 500 $a,
is review of (manifestation) (Deprecated),P30041,rdam:P30041,Relates a work to a manifestation used as the basis for a brief evaluation. (Deprecated),,,,,,,,,,,,,,Deprecated,,
is critique of (manifestation) (Deprecated),P30042,rdam:P30042,Relates a work to a manifestation used as the basis for a critical evaluation. (Deprecated),,,,,,,,,,,,,,Deprecated,,
is reproduction of manifestation of,P30043,rdam:P30043,Relates a manifestation to a manifestation that is used as the basis for a reproduction.,Manifestation,Manifestation,0,,O ,Unstructured,Normalised,,MARC 21,500 $a,,24.5,2,Published,May also be unstructured 500 $a,
is commentary on (manifestation) (Deprecated),P30044,rdam:P30044,Relates a work to a manifestation used as the basis for a set of explanatory or critical notes. (Deprecated),,,,,,,,,,,,,,Deprecated,,
is facsimile of manifestation of,P30047,rdam:P30047,Relates a manifestation to a manifestation that is used as the basis for an exact reproduction.,Manifestation,Manifestation,0,,O ,Unstructured,Normalised,,MARC 21,500 $a,,24.5,2,Published,May also be unstructured 500 $a (or 264 $b?),
has note on issue or part or iteration used as basis for identification of manifestation,P30050,rdam:P30050,Relates a manifestation to a note that identifies a part or iteration that is used for the base description of a multiunit or integrating manifestation.,Manifestation,N/A,0,,O ,Unstructured,Normalised,,MARC 21,500 $a,,2.17.13,6,Published,,
has note on changes in carrier characteristics,P30051,rdam:P30051,"Relates a manifestation to a note on manifestation that provides information on variations in the carrier characteristics that are found on manifestations of parts, issues, or iterations of a diachronic work.",Manifestation,N/A,0,>1,O ,Unstructured,Normalised,,MARC 21,500 $a,,3.21.4,6,Published,344 $a (structured) may be used in future,
has note on distribution statement,P30052,rdam:P30052,Relates a manifestation to a note on manifestation that provides information on the distribution of a manifestation.,Manifestation,N/A,0,,O ,Unstructured,Normalised,,MARC 21,500 $a,,2.17.8,6,Published,,
has note on publication statement,P30055,rdam:P30055,Relates a manifestation to a note on manifestation that provides information on the publication of a manifestation.,Manifestation,N/A,0,,O ,Unstructured,Normalised,,MARC 21,500 $a,,2.17.7,6,Published,,
has note on frequency (Deprecated),P30056,rdam:P30056,"Relates a manifestation to a note providing details on the currency of the contents, on the frequency of release of issues or parts of a serial or the frequency of updates to an integrating resource, or on changes in frequency. (Deprecated)",,,,,,,,,,,,,,Deprecated,,
has note on statement of responsibility,P30057,rdam:P30057,"Relates a manifestation to note on manifestation that provides information on an agent, and their function, who is responsible for a work or its expression that is embodied by a manifestation.",Manifestation,N/A,0,,O ,Unstructured,Normalised,,MARC 21,500 $a,,2.17.3,6,Published,,
has note on series statement,P30058,rdam:P30058,Relates a manifestation to a note on manifestation that provides information on a series with which a manifestation is associated.,Manifestation,N/A,0,,O ,Unstructured,Normalised,,MARC 21,500 $a,,2.17.11,6,Published,,
has note on dimensions of manifestation,P30060,rdam:P30060,Relates a manifestation to a note on manifestation that provides information on the dimensions of a manifestation.,Manifestation,N/A,0,,O ,Unstructured,Normalised,,MARC 21,500 $a,,3.21.3,6,Published,,
has note on extent of manifestation,P30061,rdam:P30061,Relates a manifestation to a note on manifestation that provides information on the extent of a manifestation.,Manifestation,N/A,0,,O ,Unstructured,Normalised,,MARC 21,500 $a,,3.21.2,6,Published,,
has note on numbering of sequence,P30062,rdam:P30062,Relates a manifestation to a note on manifestation that provides information on the range of designators that is used to indicate a sequence of the individual parts or iterations of a manifestation.,Manifestation,N/A,0,,O ,Unstructured,Normalised,,MARC 21,500 $a,,2.17.5,6,Published,,
has note on title,P30063,rdam:P30063,"Relates a manifestation to a note on manifestation that provides information on inaccuracies appearing in titles, complex changes in titles, or on other information relating to a title.",Manifestation,N/A,0,,O ,Unstructured,Normalised,,MARC 21,500 $a,,2.17.2,6,Published,,
has note on edition statement,P30064,rdam:P30064,Relates a manifestation to a note on manifestation that provides information on an edition of a manifestation.,Manifestation,N/A,0,,O ,Unstructured,Normalised,,MARC 21,500 $a,,2.17.4,6,Published,,
has publisher number for notated music,P30065,rdam:P30065,"Relates a manifestation to a nomen that is an identifier for manifestation other than a plate number for notated music, assigned by a publisher to a manifestation of a notated music expression.",Manifestation,Nomen,0,1,MA,Identifier,Normalised,,MARC 21,028 $a,,2.15.2,3,Published,Instruction number supplied,
has plate number for notated music,P30066,rdam:P30066,"Relates a manifestation to a nomen that is an identifier for manifestation other than a publisher number for notated music, assigned by a publisher to a manifestation of a notated music expression to indicate the printing plate used in the printing process.",Manifestation,Nomen,0,1,O,Identifier,Normalised,,MARC 21,028 $a,,2.15.3,3,Published,,
has other agent associated with manifestation (Deprecated),P30079,rdam:P30079,"Relates a manifestation to an agent other than a producer, publisher, distributor, or manufacturer who is associated with a manifestation. (Deprecated)",,,,,,,,,,,,,,Deprecated,,
has publisher agent,P30083,rdam:P30083,"Relates a manifestation to an agent who is responsible for publishing, releasing, or issuing a published manifestation.",Manifestation,Agent,0,1,MA,Unstructured,Normalised,,MARC 21,264 $b ,,21.3,2,Published,,
has place of publication,P30088,rdam:P30088,"Relates a manifestation to a place that is associated with the publication, release, or issuing of a published manifestation.",Manifestation,Place,1,1,M,Unstructured,Normalised,,MARC 21,264 $a,,2.8.2,3,Published,,
is reprint of manifestation of,P30093,rdam:P30093,Relates a manifestation to a manifestation that is a printed manifestation that is used as the basis for a reissue of a manifestation.,Manifestation,Manifestation,0,1,O,Unstructured,Normalised,,MARC 21,500 $a,,24.5,2,Published,,
has encoding format,P30096,rdam:P30096,Relates a manifestation to a schema or standard that is used to encode the digital content of a manifestation.,Manifestation,N/A,0,1,O,Structured,N/A,,MARC 21,300 $b,,3.19.3,5,Published,,
is special issue of (Deprecated),P30101,rdam:P30101,"Relates a manifestation to a periodical or newspaper containing a single issue or a supplementary section devoted to a special subject, with or without serial numbering. (Deprecated)",,,,,,,,,,,,,,Deprecated,,
has video format,P30104,rdam:P30104,Relates a manifestation to a schema or standard that is used to encode the analog video content of a manifestation.,Manifestation,N/A,0,1,O,Structured,N/A,RDA Video format,MARC 21,538 $a,,3.18.2,4,Published,May also be unstructured 500 $a,
has video format,P30104,rdam:P30104,Relates a manifestation to a schema or standard that is used to encode the analog video content of a manifestation.,Manifestation,N/A,0,1,O,Structured,N/A,RDA Video format,MARC 21,346 $a,,3.18.2,4,Published,May also be unstructured 500 $a,
has statement of responsibility relating to title proper,P30105,rdam:P30105,,Manifestation,N/A,0,1,MA,Unstructured,Normalised,,MARC 21,245 $c,,2.4.2,6,Published,,
has statement of responsibility relating to title proper,P30105,rdam:P30105,Relates a manifestation to a statement of responsibility that is associated with a title proper.,,,,,,,,,,,,,,Published,,
has statement of responsibility relating to named revision of edition,P30118,rdam:P30118,Relates a manifestation to a statement of responsibility that is associated with a named revision of an edition.,Manifestation,N/A,0,,MA,Unstructured,Normalised,,MARC 21,250 $b,,2.5.8,6,Published,,
has statement of responsibility relating to series,P30119,rdam:P30119,Relates a manifestation to a statement of responsibility that is associated with a series.,Manifestation,N/A,0,>1,MA,Unstructured,Normalised,,MARC 21,490 $a,,2.12.6,6,Published,May also be unstructured 500 $a (or 264 $b?),
has statement of responsibility relating to subseries (Deprecated),P30120,rdam:P30120,Relates a manifestation to a statement relating to the identification of agents responsible for a subseries. (Deprecated),,,,,,,,,,,,,,Deprecated,,
has statement of responsibility relating to edition,P30121,rdam:P30121,Relates a manifestation to a statement of responsibility that is associated with an edition.,Manifestation,N/A,0,1,MA,Unstructured,Normalised,,MARC 21,250 $b,,2.5.4,6,Published,,
has broadcast standard,P30123,rdam:P30123,Relates a manifestation to a system used to format a manifestation of a video for television broadcast.,Manifestation,N/A,0,1,O,Unstructured,Normalised,RDA Broadcast Standard,MARC 21,538 $a,,3.18.3,4,Published,,
has broadcast standard,P30123,rdam:P30123,Relates a manifestation to a system used to format a manifestation of a video for television broadcast.,Manifestation,N/A,0,1,O,Structured,N/A,RDA Broadcast Standard,MARC 21,346 $b,,,,Published,,
has digital file characteristic,P30124,rdam:P30124,"Relates a manifestation to a technical specification relating to the digital encoding of text, image, audio, video, or other types of data in a manifestation.",Manifestation,N/A,0,1,O,Unstructured,N/A,,MARC 21,500 $a,,3.19,4,Published,,
has sound characteristic,P30125,rdam:P30125,Relates a manifestation to a technical specification relating to the encoding of sound in a manifestation.,Manifestation,N/A,0,1,O,Unstructured,n,,MARC 21,300 $b,,3.16,6,Published,May also be unstructured 500 $a,
has sound characteristic,P30125,rdam:P30125,Relates a manifestation to a technical specification relating to the encoding of sound in a manifestation.,Manifestation,N/A,0,1,O,Structured,N/A,,MARC 21,344 $a $g,,3.16,6,Published,May also be unstructured 500 $a,
has video characteristic,P30126,rdam:P30126,Relates a manifestation to a technical specification relating to the encoding of video images in a manifestation.,Manifestation,N/A,0,1,O,Structured,N/A,,MARC 21,300 $b,,3.18,4,Published,May also be unstructured 500 $a,
has variant title of manifestation,P30128,rdam:P30128,Relates a manifestation to a nomen that is a title of manifestation that is not selected for preference in a specific application or context.,Manifestation,Nomen,0,>1,MA,Unstructured,Normalised,,MARC 21,246 $a,,2.3.6,3,Published,May also be unstructured 500 $a,
has later title proper (Deprecated),P30129,rdam:P30129,Relates a manifestation to a title proper appearing on a later issue or part of a multipart monograph or serial that differs from that on the first or earliest issue or part. (Deprecated),,,,,,,,,,,,,,Deprecated,,
has earlier title proper (Deprecated),P30130,rdam:P30130,Relates a manifestation to a title proper appearing on an earlier iteration of an integrating resource that differs from that on the current iteration. (Deprecated),,,,,,,,,,,,,,Deprecated,,
has designation of named revision of edition,P30132,rdam:P30132,"Relates a manifestation to a word, character, or group of words or characters, that identifies a particular revision of a named edition.",Manifestation,N/A,0,1,O,Unstructured,Normalised,,MARC 21,250 $a,,2.5.6,6,Published,346 $a (structured) may be used in future,
has designation of edition,P30133,rdam:P30133,,Manifestation,N/A,0,1,O,Unstructured,Normalised,,MARC 21,250 $a,,2.5.2,6,Published,,
has designation of edition,P30133,rdam:P30133,"Relates a manifestation to a word, character, or group of words or characters, that identifies an edition to which a manifestation belongs.",,,,,,,,,,,,,,Published,,
has work manifested,P30135,rdam:P30135,Relates a manifestation to a work that is embodied by a manifestation.,,,,,,,,,,,,,,Published,,
has note on manifestation,P30137,rdam:P30137,Relates a manifestation to a broad unstructured description of one or more attributes of a manifestation.,Manifestation,N/A,0,>1,Optional,Unstructured,N/A,,MARC 21,500 $a,,2.17,6,Published,,
has special playback characteristic,P30138,rdam:P30138,,Manifestation,N/A,0,>1,O,Unstructured,Normalised,,MARC 21,500 $a,,3.16.9,6,Published,May also be unstructured 500 $a,
has special playback characteristic,P30138,rdam:P30138,,Manifestation,N/A,0,>1,O,Structured,n/A,RDA special Playback characteristic,MARC 21,538 $a,,3.16.9,6,Published,May also be unstructured 500 $a,
has special playback characteristic,P30138,rdam:P30138,"Relates a manifestation to an equalization system, noise-reduction system, or other processing that is used in making an audio recording.",,,,,,,,,,,,,,Published,,
has other title information,P30142,rdam:P30142,"Relates a manifestation to a word, character, or group of words or characters that appears in conjunction with, and is subordinate to, a title proper of a manifestation.",Manifestation,N/A,0,>1,MA,Unstructured,Normalised,,MARC 21,245 $b,,2.3.4,6,Published,,
has other title information of series,P30143,rdam:P30143,"Relates a manifestation to a word, character, or group of words or characters that appears in conjunction with, and is subordinate to, a title of series.",Manifestation,N/A,0,>1,MA,Unstructured,Normalised,,MARC 21,490 $a,,2.12.4,6,Published,,
has other title information of series,P30143,rdam:P30143,"Relates a manifestation to a word, character, or group of words or characters that appears in conjunction with, and is subordinate to, a title of series.",Manifestation,N/A,0,>1,MA,Structured,n/A,SCIS Authorities,MARC 21,830 $a,,2.12.4,6,Published,,
has other title information of subseries (Deprecated),P30144,rdam:P30144,"Relates a manifestation to a word, character, or group of words or characters that appears in conjunction with, and is subordinate to, a title proper of a subseries. (Deprecated)",,,,,,,,,,,,,,Deprecated,,
has restriction on access to manifestation,P30145,rdam:P30145,Relates a manifestation to a limitation placed on access to a manifestation.,Manifestation,N/A,0,>1,MA,Unstructured,N/A,,MARC 21,500 $a,,4.4,6,Published,May also be unstructured 500 $a,
has parallel other title information,P30151,rdam:P30151,Relates a manifestation to an other title information in another language or script.,Manifestation,N/A,0,>1,O,Unstructured,Normalised,,MARC 21,245 $b [$n $p],,2.3.5,3,Published,,
has parallel other title information of subseries (Deprecated),P30153,rdam:P30153,Relates a manifestation to an other title information of a subseries in another language or script. (Deprecated),,,,,,,,,,,,,,Deprecated,,
has uniform resource locator,P30154,rdam:P30154,Relates a manifestation to an address of an online resource.,Manifestation,N/A,0,>1,MA,Structured,N/A,,MARC 21,856 $u,,4.6,6,Published,May also be unstructured 500 $a,
has title proper,P30156,rdam:P30156,Relates a manifestation to a nomen that is a title of manifestation that is selected for preference in a specific application or context.,Manifestation,Nomen,1,1,Required,Unstructured,Normalised,,MARC 21,245 $a [$n $p],,2.3.2,3,Published,May also be unstructured 500 $a,
has title of series,P30157,rdam:P30157,Relates a manifestation to a nomen that is a title that identifies a series to which a manifestation belongs.,Manifestation,Nomen,0,>1,MA,Unstructured,Normalised,,MARC 21,490 $a,,2.12.2,3,Published,May also be unstructured 500 $a,
has title of series,P30157,rdam:P30157,Relates a manifestation to a nomen that is a title that identifies a series to which a manifestation belongs.,Manifestation,Nomen,0,>1,MA,Structured,n/a,SCIS Authorities,MARC 21,830 $a,,2.12.2,3,Published,May also be unstructured 500 $a,
has title proper of subseries (Deprecated),P30158,rdam:P30158,Relates a manifestation to a name of a series appearing on a manifestation of an issue of a subseries. (Deprecated),,,,,,,,,,,,,,Deprecated,,
