*label_en,lexicalAlias_en,*uri,*type,domain,subPropertyOf[0],subPropertyOf[1],subPropertyOf[2],*status
has restriction on use of manifestation,rdamd:restrictionOnUseOfManifestation.en,rdamd:P30146,property,rdac:C10007,rdam:P30146,,,Published
has series statement,rdamd:seriesStatement.en,rdamd:P30106,property,rdac:C10007,rdam:P30106,,,Published
has sound characteristic,rdamd:soundCharacteristic.en,rdamd:P30125,property,rdac:C10007,rdam:P30125,,,Published
has sound content,rdamd:soundContent.en,rdamd:P30454,property,rdac:C10007,rdam:P30454,,,Published
is source consulted of,rdamd:sourceConsultedOf.en,rdamd:P30334,property,rdac:C10007,rdam:P30334,rdamd:P30265,,Published
has special playback characteristic,rdamd:specialPlaybackCharacteristic.en,rdamd:P30138,property,rdac:C10007,rdam:P30138,rdamd:P30125,,Published
has statement of responsibility,rdamd:statementOfResponsibility.en,rdamd:P30117,property,rdac:C10007,rdam:P30117,,,Published
has statement of responsibility relating to edition,rdamd:statementOfResponsibilityRelatingToEdition.en,rdamd:P30121,property,rdac:C10007,rdam:P30121,rdamd:P30117,,Published
has statement of responsibility relating to named revision of edition,rdamd:statementOfResponsibilityRelatingToNamedRevisionOfEdition.en,rdamd:P30118,property,rdac:C10007,rdam:P30118,rdamd:P30117,,Published
has statement of responsibility relating to series,rdamd:statementOfResponsibilityRelatingToSeries.en,rdamd:P30119,property,rdac:C10007,rdam:P30119,rdamd:P30117,,Published
has statement of responsibility relating to title proper,rdamd:statementOfResponsibilityRelatingToTitleProper.en,rdamd:P30105,property,rdac:C10007,rdam:P30105,rdamd:P30117,,Published
is subject manifestation of,rdamd:subjectManifestationOf.en,rdamd:P30253,property,rdac:C10007,rdam:P30253,rdamd:P30265,rdaxd:P00014,Published
has supplementary content,rdamd:supplementaryContent.en,rdamd:P30455,property,rdac:C10007,rdam:P30455,,,Published
has surveyor agent,rdamd:surveyorAgent.en,rdamd:P30312,property,rdac:C10007,rdam:P30312,rdamd:P30315,,Published
has surveyor collective agent,rdamd:surveyorCollectiveAgent.en,rdamd:P30366,property,rdac:C10007,rdam:P30366,rdamd:P30367,rdamd:P30312,Published
has surveyor corporate body,rdamd:surveyorCorporateBody.en,rdamd:P30395,property,rdac:C10007,rdam:P30395,rdamd:P30396,rdamd:P30366,Published
has surveyor family,rdamd:surveyorFamily.en,rdamd:P30424,property,rdac:C10007,rdam:P30424,rdamd:P30425,rdamd:P30366,Published
has surveyor person,rdamd:surveyorPerson.en,rdamd:P30337,property,rdac:C10007,rdam:P30337,rdamd:P30338,rdamd:P30312,Published
has tape configuration,rdamd:tapeConfiguration.en,rdamd:P30185,property,rdac:C10007,rdam:P30185,rdamd:P30125,,Published
has term of availability,rdamd:termOfAvailability.en,rdamd:P30160,property,rdac:C10007,rdam:P30160,,,Published
has title of manifestation,rdamd:titleOfManifestation.en,rdamd:P30134,property,rdac:C10007,rdam:P30134,rdamd:P30277,rdaxd:P00019,Published
has title of series,rdamd:titleOfSeries.en,rdamd:P30157,property,rdac:C10007,rdam:P30157,rdamd:P30134,,Published
has title proper,rdamd:titleProper.en,rdamd:P30156,property,rdac:C10007,rdam:P30156,rdamd:P30134,rdaxd:P00021,Published
has track configuration,rdamd:trackConfiguration.en,rdamd:P30161,property,rdac:C10007,rdam:P30161,rdamd:P30125,,Published
has type of binding,rdamd:typeOfBinding.en,rdamd:P30309,property,rdac:C10007,rdam:P30309,,,Published
has type of recording,rdamd:typeOfRecording.en,rdamd:P30172,property,rdac:C10007,rdam:P30172,rdamd:P30125,,Published
has uniform resource locator,rdamd:uniformResourceLocator.en,rdamd:P30154,property,rdac:C10007,rdam:P30154,,,Published
has variant access point for manifestation,rdamd:variantAccessPointForManifestation.en,rdamd:P30295,property,rdac:C10007,rdam:P30295,rdamd:P30276,rdaxd:P00022,Published
has variant title of manifestation,rdamd:variantTitleOfManifestation.en,rdamd:P30128,property,rdac:C10007,rdam:P30128,rdamd:P30134,rdaxd:P00023,Published
has video characteristic,rdamd:videoCharacteristic.en,rdamd:P30126,property,rdac:C10007,rdam:P30126,,,Published
has video format,rdamd:videoFormat.en,rdamd:P30104,property,rdac:C10007,rdam:P30104,rdamd:P30126,,Published
has work manifested,rdamd:workManifested.en,rdamd:P30135,property,rdac:C10007,rdam:P30135,rdamd:P30265,,Published
has accompanying manifestation relationship with (Deprecated),rdamd:accompanyingManifestationRelationship.en,rdamd:P30210,property,rdac:C10007,rdam:P30210,,,Deprecated
has earlier title proper (Deprecated),rdamd:earlierTitleProper.en,rdamd:P30130,property,rdac:C10007,rdam:P30130,rdamd:P30156,,Deprecated
has equivalent manifestation relationship with (Deprecated),rdamd:equivalentManifestationRelationship.en,rdamd:P30212,property,rdac:C10007,rdam:P30212,,,Deprecated
has frequency (Deprecated),rdamd:frequency.en,rdamd:P30168,property,rdac:C10007,rdam:P30168,,,Deprecated
has ISSN of series (Deprecated),rdamd:issnOfSeries.en,rdamd:P30166,property,rdac:C10007,rdam:P30166,,,Deprecated
has ISSN of subseries (Deprecated),rdamd:issnOfSubseries.en,rdamd:P30167,property,rdac:C10007,rdam:P30167,,,Deprecated
has key title (Deprecated),rdamd:keyTitle.en,rdamd:P30209,property,rdac:C10007,rdam:P30209,rdamd:P30134,,Deprecated
has later title proper (Deprecated),rdamd:laterTitleProper.en,rdamd:P30129,property,rdac:C10007,rdam:P30129,rdamd:P30156,,Deprecated
has note on frequency (Deprecated),rdamd:noteOnFrequency.en,rdamd:P30056,property,rdac:C10007,rdam:P30056,rdamd:P30137,,Deprecated
has numbering within subseries (Deprecated),rdamd:numberingWithinSubseries.en,rdamd:P30015,property,rdac:C10007,rdam:P30015,,,Deprecated
has other agent associated with manifestation (Deprecated),rdamd:otherAgentManifestation.en,rdamd:P30079,property,rdac:C10007,rdam:P30079,rdamd:P30267,,Deprecated
has other title information of subseries (Deprecated),rdamd:otherTitleInformationOfSubseries.en,rdamd:P30144,property,rdac:C10007,rdam:P30144,,,Deprecated
has parallel other title information of subseries (Deprecated),rdamd:parallelOtherTitleInformationOfSubseries.en,rdamd:P30153,property,rdac:C10007,rdam:P30153,rdamd:P30144,rdamd:P30152,Deprecated
has parallel statement of responsibility relating to subseries (Deprecated),rdamd:parallelStatementOfResponsibilityRelatingToSubseries.en,rdamd:P30114,property,rdac:C10007,rdam:P30114,rdamd:P30120,,Deprecated
has parallel title proper of subseries (Deprecated),rdamd:parallelTitleProperOfSubseries.en,rdamd:P30205,property,rdac:C10007,rdam:P30205,rdamd:P30158,rdamd:P30204,Deprecated
has special issue (Deprecated),rdamd:specialIssue.en,rdamd:P30030,property,rdac:C10007,rdam:P30030,rdamd:P30033,,Deprecated
is special issue of (Deprecated),rdamd:specialIssueOf.en,rdamd:P30101,property,rdac:C10007,rdam:P30101,rdamd:P30020,,Deprecated
has statement of responsibility relating to subseries (Deprecated),rdamd:statementOfResponsibilityRelatingToSubseries.en,rdamd:P30120,property,rdac:C10007,rdam:P30120,rdamd:P30117,,Deprecated
has title proper of subseries (Deprecated),rdamd:titleProperOfSubseries.en,rdamd:P30158,property,rdac:C10007,rdam:P30158,rdamd:P30157,,Deprecated
has whole-part manifestation relationship with (Deprecated),rdamd:wholePartManifestationRelationship.en,rdamd:P30213,property,rdac:C10007,rdam:P30213,,,Deprecated