*label_en,lexicalAlias_en,*uri,*type,domain,subPropertyOf[0],subPropertyOf[1],subPropertyOf[2],*status
has abbreviated title,rdamd:abbreviatedTitle.en,rdamd:P30131,property,rdac:C10007,rdam:P30131,rdamd:P30134,,Published
has accessibility content,rdamd:accessibilityContent.en,rdamd:P30452,property,rdac:C10007,rdam:P30452,rdamd:P30455,,Published
has access point for manifestation,rdamd:accessPointForManifestation.en,rdamd:P30276,property,rdac:C10007,rdam:P30276,rdamd:P30277,rdaxd:P00016,Published
is accompanied by manifestation,rdamd:accompaniedByManifestation.en,rdamd:P30027,property,rdac:C10007,rdam:P30027,rdamd:P30048,,Published
is also issued as,rdamd:alsoIssuedAs.en,rdamd:P30026,property,rdac:C10007,rdam:P30026,rdamd:P30024,,Published
has appellation of manifestation,rdamd:appellationOfManifestation.en,rdamd:P30277,property,rdac:C10007,rdam:P30277,rdamd:P30274,rdaxd:P00017,Published
has applied material,rdamd:appliedMaterial.en,rdamd:P30084,property,rdac:C10007,rdam:P30084,rdamd:P30304,,Published
has authorized access point for manifestation,rdamd:authorizedAccessPointForManifestation.en,rdamd:P30294,property,rdac:C10007,rdam:P30294,rdamd:P30276,rdaxd:P00020,Published
has base material,rdamd:baseMaterial.en,rdamd:P30208,property,rdac:C10007,rdam:P30208,rdamd:P30304,,Published
has bibliographic format,rdamd:bibliographicFormat.en,rdamd:P30197,property,rdac:C10007,rdam:P30197,,,Published
has binding of manifestation,rdamd:bindingOfManifestation.en,rdamd:P30310,property,rdac:C10007,rdam:P30310,rdamd:P30265,,Published
has book designer agent,rdamd:bookDesignerAgent.en,rdamd:P30069,property,rdac:C10007,rdam:P30069,rdamd:P30082,,Published
has book designer collective agent,rdamd:bookDesignerCollectiveAgent.en,rdamd:P30378,property,rdac:C10007,rdam:P30378,rdamd:P30390,rdamd:P30069,Published
has book designer corporate body,rdamd:bookDesignerCorporateBody.en,rdamd:P30407,property,rdac:C10007,rdam:P30407,rdamd:P30419,rdamd:P30378,Published
has book designer family,rdamd:bookDesignerFamily.en,rdamd:P30436,property,rdac:C10007,rdam:P30436,rdamd:P30448,rdamd:P30378,Published
has book designer person,rdamd:bookDesignerPerson.en,rdamd:P30349,property,rdac:C10007,rdam:P30349,rdamd:P30361,rdamd:P30069,Published
has braille embosser agent,rdamd:brailleEmbosserAgent.en,rdamd:P30071,property,rdac:C10007,rdam:P30071,rdamd:P30082,,Published
has braille embosser collective agent,rdamd:brailleEmbosserCollectiveAgent.en,rdamd:P30380,property,rdac:C10007,rdam:P30380,rdamd:P30390,rdamd:P30071,Published
has braille embosser corporate body,rdamd:brailleEmbosserCorporateBody.en,rdamd:P30409,property,rdac:C10007,rdam:P30409,rdamd:P30419,rdamd:P30380,Published
has braille embosser family,rdamd:brailleEmbosserFamily.en,rdamd:P30438,property,rdac:C10007,rdam:P30438,rdamd:P30448,rdamd:P30380,Published
has braille embosser person,rdamd:brailleEmbosserPerson.en,rdamd:P30351,property,rdac:C10007,rdam:P30351,rdamd:P30361,rdamd:P30071,Published
has broadcaster agent,rdamd:broadcasterAgent.en,rdamd:P30067,property,rdac:C10007,rdam:P30067,rdamd:P30083,,Published
has broadcaster collective agent,rdamd:broadcasterCollectiveAgent.en,rdamd:P30376,property,rdac:C10007,rdam:P30376,rdamd:P30391,rdamd:P30067,Published
has broadcaster corporate body,rdamd:broadcasterCorporateBody.en,rdamd:P30405,property,rdac:C10007,rdam:P30405,rdamd:P30420,rdamd:P30376,Published
has broadcaster family,rdamd:broadcasterFamily.en,rdamd:P30434,property,rdac:C10007,rdam:P30434,rdamd:P30449,rdamd:P30376,Published
has broadcaster person,rdamd:broadcasterPerson.en,rdamd:P30347,property,rdac:C10007,rdam:P30347,rdamd:P30362,rdamd:P30067,Published
has broadcast standard,rdamd:broadcastStandard.en,rdamd:P30123,property,rdac:C10007,rdam:P30123,rdamd:P30126,,Published
has carrier type,rdamd:carrierType.en,rdamd:P30001,property,rdac:C10007,rdam:P30001,,,Published
has cartographic data type,rdamd:cartographicDataType.en,rdamd:P30261,property,rdac:C10007,rdam:P30261,,,Published
has caster agent,rdamd:casterAgent.en,rdamd:P30073,property,rdac:C10007,rdam:P30073,rdamd:P30082,,Published
has caster collective agent,rdamd:casterCollectiveAgent.en,rdamd:P30382,property,rdac:C10007,rdam:P30382,rdamd:P30390,rdamd:P30073,Published
has caster corporate body,rdamd:casterCorporateBody.en,rdamd:P30411,property,rdac:C10007,rdam:P30411,rdamd:P30419,rdamd:P30382,Published
has caster family,rdamd:casterFamily.en,rdamd:P30440,property,rdac:C10007,rdam:P30440,rdamd:P30448,rdamd:P30382,Published
has caster person,rdamd:casterPerson.en,rdamd:P30353,property,rdac:C10007,rdam:P30353,rdamd:P30361,rdamd:P30073,Published
has category of manifestation,rdamd:categoryOfManifestation,rdamd:P30335,property,rdac:C10007,rdam:P30335,rdaxd:P00029,,Published
has collotyper agent,rdamd:collotyperAgent.en,rdamd:P30077,property,rdac:C10007,rdam:P30077,rdamd:P30082,,Published
has collotyper collective agent,rdamd:collotyperCollectiveAgent.en,rdamd:P30386,property,rdac:C10007,rdam:P30386,rdamd:P30390,rdamd:P30077,Published
has collotyper corporate body,rdamd:collotyperCorporateBody.en,rdamd:P30415,property,rdac:C10007,rdam:P30415,rdamd:P30419,rdamd:P30386,Published
has collotyper family,rdamd:collotyperFamily.en,rdamd:P30444,property,rdac:C10007,rdam:P30444,rdamd:P30448,rdamd:P30386,Published
has collotyper person,rdamd:collotyperPerson.en,rdamd:P30357,property,rdac:C10007,rdam:P30357,rdamd:P30361,rdamd:P30077,Published
has colour content,rdamd:colourContent.en,rdamd:P30456,property,rdac:C10007,rdam:P30456,,,Published
has configuration of playback channels,rdamd:configurationOfPlaybackChannels.en,rdamd:P30184,property,rdac:C10007,rdam:P30184,rdamd:P30125,,Published
has contact information,rdamd:contactInformation.en,rdamd:P30141,property,rdac:C10007,rdam:P30141,,,Published
has contributor agent of cartography,rdamd:contributorAgentOfCartography.en,rdamd:P30315,property,rdac:C10007,rdam:P30315,rdamd:P30327,,Published
has contributor agent of choreography,rdamd:contributorAgentOfChoreography.en,rdamd:P30316,property,rdac:C10007,rdam:P30316,rdamd:P30327,,Published
has contributor agent of computer content,rdamd:contributorAgentOfComputerContent.en,rdamd:P30333,property,rdac:C10007,rdam:P30333,rdamd:P30327,,Published
has contributor agent of moving image,rdamd:contributorAgentOfMovingImage.en,rdamd:P30326,property,rdac:C10007,rdam:P30326,rdamd:P30327,,Published
has contributor agent of music,rdamd:contributorAgentOfMusic.en,rdamd:P30311,property,rdac:C10007,rdam:P30311,rdamd:P30327,,Published
has contributor agent of object,rdamd:contributorAgentOfObject.en,rdamd:P30332,property,rdac:C10007,rdam:P30332,rdamd:P30327,,Published
has contributor agent of speech,rdamd:contributorAgentOfSpeech.en,rdamd:P30331,property,rdac:C10007,rdam:P30331,rdamd:P30327,,Published
has contributor agent of still image,rdamd:contributorAgentOfStillImage.en,rdamd:P30321,property,rdac:C10007,rdam:P30321,rdamd:P30327,,Published
has contributor agent of text,rdamd:contributorAgentOfText.en,rdamd:P30328,property,rdac:C10007,rdam:P30328,rdamd:P30327,,Published
has contributor agent to aggregate,rdamd:contributorAgentToAggregate.en,rdamd:P30327,property,rdac:C10007,rdam:P30327,rdamd:P30267,,Published
has contributor collective agent of cartography,rdamd:contributorCollectiveAgentOfCartography.en,rdamd:P30367,property,rdac:C10007,rdam:P30367,rdamd:P30365,rdamd:P30315,Published
has contributor collective agent of choreography,rdamd:contributorCollectiveAgentOfChoreography.en,rdamd:P30368,property,rdac:C10007,rdam:P30368,rdamd:P30365,rdamd:P30316,Published
has contributor collective agent of computer content,rdamd:contributorCollectiveAgentOfComputerContent.en,rdamd:P30375,property,rdac:C10007,rdam:P30375,rdamd:P30365,rdamd:P30333,Published
has contributor collective agent of moving image,rdamd:contributorCollectiveAgentOfMovingImage.en,rdamd:P30369,property,rdac:C10007,rdam:P30369,rdamd:P30365,rdamd:P30326,Published
has contributor collective agent of music,rdamd:contributorCollectiveAgentOfMusic.en,rdamd:P30370,property,rdac:C10007,rdam:P30370,rdamd:P30365,rdamd:P30311,Published
has contributor collective agent of object,rdamd:contributorCollectiveAgentOfObject.en,rdamd:P30374,property,rdac:C10007,rdam:P30374,rdamd:P30365,rdamd:P30332,Published
has contributor collective agent of speech,rdamd:contributorCollectiveAgentOfSpeech.en,rdamd:P30371,property,rdac:C10007,rdam:P30371,rdamd:P30365,rdamd:P30331,Published
has contributor collective agent of still image,rdamd:contributorCollectiveAgentOfStillImage.en,rdamd:P30372,property,rdac:C10007,rdam:P30372,rdamd:P30365,rdamd:P30321,Published
has contributor collective agent of text,rdamd:contributorCollectiveAgentOfText.en,rdamd:P30373,property,rdac:C10007,rdam:P30373,rdamd:P30365,rdamd:P30328,Published
has contributor collective agent to aggregate,rdamd:contributorCollectiveAgentToAggregate.en,rdamd:P30365,property,rdac:C10007,rdam:P30365,rdamd:P30271,rdamd:P30327,Published
has contributor corporate body of cartography,rdamd:contributorCorporateBodyOfCartography.en,rdamd:P30396,property,rdac:C10007,rdam:P30396,rdamd:P30394,rdamd:P30367,Published
has contributor corporate body of choreography,rdamd:contributorCorporateBodyOfChoreography.en,rdamd:P30397,property,rdac:C10007,rdam:P30397,rdamd:P30394,rdamd:P30368,Published
has contributor corporate body of computer content,rdamd:contributorCorporateBodyOfComputerContent.en,rdamd:P30404,property,rdac:C10007,rdam:P30404,rdamd:P30394,rdamd:P30375,Published
has contributor corporate body of moving image,rdamd:contributorCorporateBodyOfMovingImage.en,rdamd:P30398,property,rdac:C10007,rdam:P30398,rdamd:P30394,rdamd:P30369,Published
has contributor corporate body of music,rdamd:contributorCorporateBodyOfMusic.en,rdamd:P30399,property,rdac:C10007,rdam:P30399,rdamd:P30394,rdamd:P30370,Published
has contributor corporate body of object,rdamd:contributorCorporateBodyOfObject.en,rdamd:P30403,property,rdac:C10007,rdam:P30403,rdamd:P30394,rdamd:P30374,Published
has contributor corporate body of speech,rdamd:contributorCorporateBodyOfSpeech.en,rdamd:P30400,property,rdac:C10007,rdam:P30400,rdamd:P30394,rdamd:P30371,Published
has contributor corporate body of still image,rdamd:contributorCorporateBodyOfStillImage.en,rdamd:P30401,property,rdac:C10007,rdam:P30401,rdamd:P30394,rdamd:P30372,Published
has contributor corporate body of text,rdamd:contributorCorporateBodyOfText.en,rdamd:P30402,property,rdac:C10007,rdam:P30402,rdamd:P30394,rdamd:P30373,Published
has contributor corporate body to aggregate,rdamd:contributorCorporateBodyToAggregate.en,rdamd:P30394,property,rdac:C10007,rdam:P30394,rdamd:P30270,rdamd:P30365,Published
has contributor family of cartography,rdamd:contributorFamilyOfCartography.en,rdamd:P30425,property,rdac:C10007,rdam:P30425,rdamd:P30423,rdamd:P30367,Published
has contributor family of choreography,rdamd:contributorFamilyOfChoreography.en,rdamd:P30426,property,rdac:C10007,rdam:P30426,rdamd:P30423,rdamd:P30368,Published
has contributor family of computer content,rdamd:contributorFamilyOfComputerContent.en,rdamd:P30433,property,rdac:C10007,rdam:P30433,rdamd:P30423,rdamd:P30375,Published
has contributor family of moving image,rdamd:contributorFamilyOfMovingImage.en,rdamd:P30427,property,rdac:C10007,rdam:P30427,rdamd:P30423,rdamd:P30369,Published
has contributor family of music,rdamd:contributorFamilyOfMusic.en,rdamd:P30428,property,rdac:C10007,rdam:P30428,rdamd:P30423,rdamd:P30370,Published
has contributor family of object,rdamd:contributorFamilyOfObject.en,rdamd:P30432,property,rdac:C10007,rdam:P30432,rdamd:P30423,rdamd:P30374,Published
has contributor family of speech,rdamd:contributorFamilyOfSpeech.en,rdamd:P30429,property,rdac:C10007,rdam:P30429,rdamd:P30423,rdamd:P30371,Published
has contributor family of still image,rdamd:contributorFamilyOfStillImage.en,rdamd:P30430,property,rdac:C10007,rdam:P30430,rdamd:P30423,rdamd:P30372,Published
has contributor family of text,rdamd:contributorFamilyOfText.en,rdamd:P30431,property,rdac:C10007,rdam:P30431,rdamd:P30423,rdamd:P30373,Published
has contributor family to aggregate,rdamd:contributorFamilyToAggregate.en,rdamd:P30423,property,rdac:C10007,rdam:P30423,rdamd:P30269,rdamd:P30365,Published
has contributor person of cartography,rdamd:contributorPersonOfCartography.en,rdamd:P30338,property,rdac:C10007,rdam:P30338,rdamd:P30336,rdamd:P30315,Published
has contributor person of choreography,rdamd:contributorPersonOfChoreography.en,rdamd:P30339,property,rdac:C10007,rdam:P30339,rdamd:P30336,rdamd:P30316,Published
has contributor person of computer content,rdamd:contributorPersonOfComputerContent.en,rdamd:P30346,property,rdac:C10007,rdam:P30346,rdamd:P30336,rdamd:P30333,Published
has contributor person of moving image,rdamd:contributorPersonOfMovingImage.en,rdamd:P30340,property,rdac:C10007,rdam:P30340,rdamd:P30336,rdamd:P30326,Published
has contributor person of music,rdamd:contributorPersonOfMusic.en,rdamd:P30341,property,rdac:C10007,rdam:P30341,rdamd:P30336,rdamd:P30311,Published
has contributor person of object,rdamd:contributorPersonOfObject.en,rdamd:P30345,property,rdac:C10007,rdam:P30345,rdamd:P30336,rdamd:P30332,Published
has contributor person of speech,rdamd:contributorPersonOfSpeech.en,rdamd:P30342,property,rdac:C10007,rdam:P30342,rdamd:P30336,rdamd:P30331,Published
has contributor person of still image,rdamd:contributorPersonOfStillImage.en,rdamd:P30343,property,rdac:C10007,rdam:P30343,rdamd:P30336,rdamd:P30321,Published
has contributor person of text,rdamd:contributorPersonOfText.en,rdamd:P30344,property,rdac:C10007,rdam:P30344,rdamd:P30336,rdamd:P30328,Published
has contributor person to aggregate,rdamd:contributorPersonToAggregate.en,rdamd:P30336,property,rdac:C10007,rdam:P30336,rdamd:P30268,rdamd:P30327,Published
has copyright date,rdamd:copyrightDate.en,rdamd:P30007,property,rdac:C10007,rdam:P30007,rdamd:P30278,,Published
has creator agent of manifestation,rdamd:creatorAgentOfManifestation.en,rdamd:P30329,property,rdac:C10007,rdam:P30329,rdamd:P30267,,Published
has creator collective agent of manifestation,rdamd:creatorCollectiveAgentOfManifestation.en,rdamd:P30392,property,rdac:C10007,rdam:P30392,rdamd:P30271,rdamd:P30329,Published
has creator corporate body of manifestation,rdamd:creatorCorporateBodyOfManifestation.en,rdamd:P30421,property,rdac:C10007,rdam:P30421,rdamd:P30270,rdamd:P30392,Published
has creator family of manifestation,rdamd:creatorFamilyOfManifestation.en,rdamd:P30450,property,rdac:C10007,rdam:P30450,rdamd:P30269,rdamd:P30392,Published
has creator person of manifestation,rdamd:creatorPersonOfManifestation.en,rdamd:P30363,property,rdac:C10007,rdam:P30363,rdamd:P30268,rdamd:P30329,Published
has date of distribution,rdamd:dateOfDistribution.en,rdamd:P30008,property,rdac:C10007,rdam:P30008,rdamd:P30278,,Published
has date of manifestation,rdamd:dateOfManifestation.en,rdamd:P30278,property,rdac:C10007,rdam:P30278,rdamd:P30273,,Published
has date of manufacture,rdamd:dateOfManufacture.en,rdamd:P30010,property,rdac:C10007,rdam:P30010,rdamd:P30278,,Published
has date of production,rdamd:dateOfProduction.en,rdamd:P30009,property,rdac:C10007,rdam:P30009,rdamd:P30278,,Published
has date of publication,rdamd:dateOfPublication.en,rdamd:P30011,property,rdac:C10007,rdam:P30011,rdamd:P30278,,Published
has designation of edition,rdamd:designationOfEdition.en,rdamd:P30133,property,rdac:C10007,rdam:P30133,,,Published
has designation of named revision of edition,rdamd:designationOfNamedRevisionOfEdition.en,rdamd:P30132,property,rdac:C10007,rdam:P30132,,,Published
has details of applied material,rdamd:detailsOfAppliedMaterial.en,rdamd:P30216,property,rdac:C10007,rdam:P30216,,,Published
has details of base material,rdamd:detailsOfBaseMaterial.en,rdamd:P30217,property,rdac:C10007,rdam:P30217,,,Published
has details of bibliographic format,rdamd:detailsOfBibliographicFormat.en,rdamd:P30218,property,rdac:C10007,rdam:P30218,,,Published
has details of broadcast standard,rdamd:detailsOfBroadcastStandard.en,rdamd:P30219,property,rdac:C10007,rdam:P30219,rdamd:P30250,,Published
has details of cartographic data type,rdamd:detailsOfCartographicDataType.en,rdamd:P30262,property,rdac:C10007,rdam:P30262,,,Published
has details of configuration of playback channels,rdamd:detailsOfConfigurationOfPlaybackChannels.en,rdamd:P30220,property,rdac:C10007,rdam:P30220,rdamd:P30245,,Published
has details of digital file characteristic,rdamd:detailsOfDigitalFileCharacteristic.en,rdamd:P30221,property,rdac:C10007,rdam:P30221,,,Published
has details of digital representation of cartographic content,rdamd:detailsOfDigitalRepresentationOfCartographicContent.en,rdamd:P30222,property,rdac:C10007,rdam:P30222,rdamd:P30221,,Published
has details of emulsion on microfilm and microfiche,rdamd:detailsOfEmulsionOnMicrofilmAndMicrofiche.en,rdamd:P30223,property,rdac:C10007,rdam:P30223,rdamd:P30216,,Published
has details of encoding format,rdamd:detailsOfEncodingFormat.en,rdamd:P30224,property,rdac:C10007,rdam:P30224,rdamd:P30221,,Published
has details of file type,rdamd:detailsOfFileType.en,rdamd:P30225,property,rdac:C10007,rdam:P30225,rdamd:P30221,,Published
has details of font size,rdamd:detailsOfFontSize.en,rdamd:P30226,property,rdac:C10007,rdam:P30226,,,Published
has details of generation,rdamd:detailsOfGeneration.en,rdamd:P30252,property,rdac:C10007,rdam:P30252,,,Published
has details of groove characteristic,rdamd:detailsOfGrooveCharacteristic.en,rdamd:P30232,property,rdac:C10007,rdam:P30232,rdamd:P30245,,Published
has details of layout,rdamd:detailsOfLayout.en,rdamd:P30233,property,rdac:C10007,rdam:P30233,,,Published
has details of mount,rdamd:detailsOfMount.en,rdamd:P30234,property,rdac:C10007,rdam:P30234,,,Published
has details of playing speed,rdamd:detailsOfPlayingSpeed.en,rdamd:P30235,property,rdac:C10007,rdam:P30235,,,Published
has details of polarity,rdamd:detailsOfPolarity.en,rdamd:P30236,property,rdac:C10007,rdam:P30236,,,Published
has details of presentation format,rdamd:detailsOfPresentationFormat.en,rdamd:P30237,property,rdac:C10007,rdam:P30237,,,Published
has details of production method,rdamd:detailsOfProductionMethod.en,rdamd:P30238,property,rdac:C10007,rdam:P30238,,,Published
has details of projection characteristic of motion picture film,rdamd:detailsOfProjectionCharacteristicOfMotionPictureFilm.en,rdamd:P30241,property,rdac:C10007,rdam:P30241,,,Published
has details of projection speed,rdamd:detailsOfProjectionSpeed.en,rdamd:P30242,property,rdac:C10007,rdam:P30242,rdamd:P30241,,Published
has details of recording medium,rdamd:detailsOfRecordingMedium.en,rdamd:P30243,property,rdac:C10007,rdam:P30243,rdamd:P30245,,Published
has details of reduction ratio designation,rdamd:detailsOfReductionRatioDesignation.en,rdamd:P30244,property,rdac:C10007,rdam:P30244,,,Published
has details of regional encoding,rdamd:detailsOfRegionalEncoding.en,rdamd:P30275,property,rdac:C10007,rdam:P30275,rdamd:P30221,,Published
has details of sound characteristic,rdamd:detailsOfSoundCharacteristic.en,rdamd:P30245,property,rdac:C10007,rdam:P30245,,,Published
has details of special playback characteristic,rdamd:detailsOfSpecialPlaybackCharacteristic.en,rdamd:P30246,property,rdac:C10007,rdam:P30246,rdamd:P30245,,Published
has details of tape configuration,rdamd:detailsOfTapeConfiguration.en,rdamd:P30247,property,rdac:C10007,rdam:P30247,rdamd:P30245,,Published
has details of track configuration,rdamd:detailsOfTrackConfiguration.en,rdamd:P30248,property,rdac:C10007,rdam:P30248,rdamd:P30245,,Published
has details of type of recording,rdamd:detailsOfTypeOfRecording.en,rdamd:P30249,property,rdac:C10007,rdam:P30249,rdamd:P30245,,Published
has details of video characteristic,rdamd:detailsOfVideoCharacteristic.en,rdamd:P30250,property,rdac:C10007,rdam:P30250,,,Published
has details of video format,rdamd:detailsOfVideoFormat.en,rdamd:P30251,property,rdac:C10007,rdam:P30251,rdamd:P30250,,Published
has digital file characteristic,rdamd:digitalFileCharacteristic.en,rdamd:P30124,property,rdac:C10007,rdam:P30124,,,Published
has digital representation of cartographic content,rdamd:digitalRepresentationOfCartographicContent.en,rdamd:P30102,property,rdac:C10007,rdam:P30102,rdamd:P30124,,Published
has digital transfer of manifestation,rdamd:digitalTransferManifestation.en,rdamd:P30029,property,rdac:C10007,rdam:P30029,rdamd:P30039,,Published
is digital transfer of item of,rdamd:digitalTransferOfItemOf.en,rdamd:P30298,property,rdac:C10007,rdam:P30298,rdamd:P30303,,Published
is digital transfer of manifestation of,rdamd:digitalTransferOfManifestationOf.en,rdamd:P30040,property,rdac:C10007,rdam:P30040,rdamd:P30043,,Published
has dimensions,rdamd:dimensions.en,rdamd:P30169,property,rdac:C10007,rdam:P30169,,,Published
has dimensions of cartographic image,rdamd:dimensionsOfCartographicImage.en,rdamd:P30170,property,rdac:C10007,rdam:P30170,rdamd:P30171,,Published
has dimensions of still image,rdamd:dimensionsOfStillImage.en,rdamd:P30171,property,rdac:C10007,rdam:P30171,rdamd:P30169,,Published
has distribution statement,rdamd:distributionStatement.en,rdamd:P30108,property,rdac:C10007,rdam:P30108,,,Published
has distributor agent,rdamd:distributorAgent.en,rdamd:P30080,property,rdac:C10007,rdam:P30080,rdamd:P30267,,Published
has distributor collective agent,rdamd:distributorCollectiveAgent.en,rdamd:P30388,property,rdac:C10007,rdam:P30388,rdamd:P30271,rdamd:P30080,Published
has distributor corporate body,rdamd:distributorCorporateBody.en,rdamd:P30417,property,rdac:C10007,rdam:P30417,rdamd:P30270,rdamd:P30388,Published
has distributor family,rdamd:distributorFamily.en,rdamd:P30446,property,rdac:C10007,rdam:P30446,rdamd:P30269,rdamd:P30388,Published
has distributor person,rdamd:distributorPerson.en,rdamd:P30359,property,rdac:C10007,rdam:P30359,rdamd:P30268,rdamd:P30080,Published
has edition statement,rdamd:editionStatement.en,rdamd:P30107,property,rdac:C10007,rdam:P30107,,,Published
is electronic reproduction of item of,rdamd:electronicReproductionOfItemOf.en,rdamd:P30299,property,rdac:C10007,rdam:P30299,rdamd:P30303,,Published
has electronic reproduction of manifestation,rdamd:electronicReproductionOfManifestation.en,rdamd:P30016,property,rdac:C10007,rdam:P30016,rdamd:P30039,,Published
is electronic reproduction of manifestation of,rdamd:electronicReproductionOfManifestationOf.en,rdamd:P30136,property,rdac:C10007,rdam:P30136,rdamd:P30043,,Published
has emulsion on microfilm and microfiche,rdamd:emulsionOnMicrofilmAndMicrofiche.en,rdamd:P30122,property,rdac:C10007,rdam:P30122,rdamd:P30084,,Published
has encoded bitrate,rdamd:encodedBitrate.en,rdamd:P30202,property,rdac:C10007,rdam:P30202,rdamd:P30124,,Published
has encoding format,rdamd:encodingFormat.en,rdamd:P30096,property,rdac:C10007,rdam:P30096,rdamd:P30124,,Published
has engraver agent,rdamd:engraverAgent.en,rdamd:P30070,property,rdac:C10007,rdam:P30070,rdamd:P30082,,Published
has engraver collective agent,rdamd:engraverCollectiveAgent.en,rdamd:P30379,property,rdac:C10007,rdam:P30379,rdamd:P30390,rdamd:P30070,Published
has engraver corporate body,rdamd:engraverCorporateBody.en,rdamd:P30408,property,rdac:C10007,rdam:P30408,rdamd:P30419,rdamd:P30379,Published
has engraver family,rdamd:engraverFamily.en,rdamd:P30437,property,rdac:C10007,rdam:P30437,rdamd:P30448,rdamd:P30379,Published
has engraver person,rdamd:engraverPerson.en,rdamd:P30350,property,rdac:C10007,rdam:P30350,rdamd:P30361,rdamd:P30070,Published
has equipment or system requirement,rdamd:equipmentOrSystemRequirement.en,rdamd:P30162,property,rdac:C10007,rdam:P30162,,,Published
has equivalent manifestation,rdamd:equivalentManifestation.en,rdamd:P30024,property,rdac:C10007,rdam:P30024,rdamd:P30048,,Published
has etcher agent,rdamd:etcherAgent.en,rdamd:P30076,property,rdac:C10007,rdam:P30076,rdamd:P30082,,Published
has etcher collective agent,rdamd:etcherCollectiveAgent.en,rdamd:P30385,property,rdac:C10007,rdam:P30385,rdamd:P30390,rdamd:P30076,Published
has etcher corporate body,rdamd:etcherCorporateBody.en,rdamd:P30414,property,rdac:C10007,rdam:P30414,rdamd:P30419,rdamd:P30385,Published
has etcher family,rdamd:etcherFamily.en,rdamd:P30443,property,rdac:C10007,rdam:P30443,rdamd:P30448,rdamd:P30385,Published
has etcher person,rdamd:etcherPerson.en,rdamd:P30356,property,rdac:C10007,rdam:P30356,rdamd:P30361,rdamd:P30076,Published
has exemplar of manifestation,rdamd:exemplarOfManifestation.en,rdamd:P30103,property,rdac:C10007,rdam:P30103,rdamd:P30140,,Published
has expression manifested,rdamd:expressionManifested.en,rdamd:P30139,property,rdac:C10007,rdam:P30139,rdamd:P30266,,Published
has extent of manifestation,rdamd:extentOfManifestation.en,rdamd:P30182,property,rdac:C10007,rdam:P30182,,,Published
is facsimile of item of,rdamd:facsimileOfItem.en,rdamd:P30300,property,rdac:C10007,rdam:P30300,rdamd:P30303,,Published
has facsimile of manifestation,rdamd:facsimileOfManifestation.en,rdamd:P30031,property,rdac:C10007,rdam:P30031,rdamd:P30039,,Published
is facsimile of manifestation of,rdamd:facsimileOfManifestation.en,rdamd:P30047,property,rdac:C10007,rdam:P30047,rdamd:P30043,,Published
has facsimile part,rdamd:facsimilePart.en,rdamd:P30046,property,rdac:C10007,rdam:P30046,rdamd:P30033,,Published
is facsimile part of,rdamd:facsimilePartOf.en,rdamd:P30019,property,rdac:C10007,rdam:P30019,rdamd:P30020,,Published
has file size,rdamd:fileSize.en,rdamd:P30183,property,rdac:C10007,rdam:P30183,rdamd:P30124,,Published
has file type,rdamd:fileType.en,rdamd:P30018,property,rdac:C10007,rdam:P30018,rdamd:P30124,,Published
has film distributor agent,rdamd:filmDistributorAgent.en,rdamd:P30068,property,rdac:C10007,rdam:P30068,rdamd:P30080,,Published
has film distributor collective agent,rdamd:filmDistributorCollectiveAgent.en,rdamd:P30377,property,rdac:C10007,rdam:P30377,rdamd:P30388,rdamd:P30068,Published
